{
  "id": "oc-a11y-check",
  "name": "Accessibility Compliance Check",
  "description": "Audits tinyland.dev for WCAG accessibility violations. Analyzes Svelte components for ARIA attributes, semantic HTML, keyboard navigation, and color contrast issues.",
  "agent": "openclaw",
  "trigger": {
    "schedule": "0 5 * * 3",
    "event": "manual"
  },
  "targets": [
    {
      "forge": "github",
      "org": "tinyland-inc",
      "repo": "tinyland.dev",
      "branch": "main"
    }
  ],
  "tools": [
    "juggler_resolve_composite",
    "juggler_audit_log",
    "juggler_campaign_status",
    "juggler_setec_put"
  ],
  "process": [
    "Resolve github-token via juggler_resolve_composite for GitHub API access",
    "Fetch all .svelte and .html files from tinyland.dev via GitHub API",
    "Analyze for missing ARIA attributes (role, aria-label, aria-describedby)",
    "Check for semantic HTML usage (nav, main, aside, header, footer vs div-soup)",
    "Verify keyboard navigation patterns (tabindex, focus management, skip links)",
    "Cross-reference with tinyland-a11y-engine rules and store violation report with WCAG level references (A, AA, AAA)"
  ],
  "outputs": {
    "setecKey": "remotejuggler/campaigns/oc-a11y-check",
    "issueLabels": [
      "campaign",
      "accessibility"
    ],
    "issueRepo": "tinyland-inc/tinyland.dev"
  },
  "guardrails": {
    "maxDuration": "20m",
    "readOnly": true,
    "aiApiBudget": {
      "maxTokens": 80000
    }
  },
  "feedback": {
    "createIssues": true,
    "createPRs": false,
    "closeResolvedIssues": true
  },
  "metrics": {
    "successCriteria": "All Svelte components analyzed, WCAG violations categorized",
    "kpis": [
      "components_analyzed",
      "violations_a",
      "violations_aa",
      "violations_aaa",
      "regression_count"
    ]
  }
}
